{
  "schema_version": "1.0",
  "patch_id": "41000000-0000-4000-8000-000000000008",
  "action": "modify_function",
  "target": {
    "file": "tests/test_text_metrics.py",
    "symbol": "test_summarize_text_counts_and_terms",
    "symbol_type": "function"
  },
  "changes": {
    "operation": "replace_body",
    "payload": "from text_metrics import summarize_text\n\nsummary = summarize_text(\"Aether heals code. Aether saves tokens.\", top_n=2)\nassert summary[\"characters\"] == 39\nassert summary[\"words\"] == 6\nassert summary[\"unique_words\"] == 5\nassert summary[\"top_terms\"] == [(\"aether\", 2), (\"code\", 1)]\n"
  },
  "metadata": {
    "agent_id": "codex-aether-demo",
    "model": "gpt-5-codex",
    "intent": "Correct the expected character count after test execution revealed the assertion bug."
  }
}
